{
  "schema_version": "0.2.0",
  "decision_id": "EXAMPLE-PASS-001",
  "title": "Standard domestic quote",
  "description": "Approve a standard quote supported by a current price list.",
  "use_case": "commercial-quotation",
  "status": "DRAFT",
  "assurance_level": "BASIC",
  "created_at": "2026-07-28T06:00:00Z",
  "updated_at": "2026-07-28T06:00:00Z",
  "created_by": {"id": "sales-agent", "role": "GENERATOR", "kind": "AGENT"},
  "requested_by": {"id": "sales-requester", "role": "OWNER", "kind": "HUMAN"},
  "current_owner": {"id": "case-owner", "role": "OWNER", "kind": "HUMAN"},
  "canonical_action": null,
  "claims": [{"id": "CLAIM-1", "statement": "The quote uses the current approved price list.", "mandatory_evidence": true}],
  "evidence": [{"id": "EVIDENCE-1", "claim_refs": ["CLAIM-1"], "source_ref": "evidence/price-list.json", "status": "VERIFIED", "observed_at": "2026-07-28T05:00:00Z", "content_hash": "sha256:example"}],
  "assumptions": [],
  "constraints": [{"id": "MARGIN-1", "severity": "MANDATORY", "satisfied": true, "reason_code": "MINIMUM_MARGIN"}],
  "policies": [{"id": "QUOTE-POLICY", "version": "1.0", "requires_review": false}],
  "risks": [{"id": "RISK-1", "level": "LOW", "unresolved": false}],
  "conflicts": [],
  "validation_results": [],
  "review_requirements": [{"id": "APPROVAL-1", "required_role": "APPROVER", "mandatory": true, "satisfied": false}],
  "approvals": [],
  "decision_outcome": null,
  "outcome_reasons": [],
  "audit_events": []
}
