{
  "schema_version": "0.2.0", "decision_id": "EXAMPLE-REVIEW-001", "title": "Supplier onboarding", "description": "Supplier onboarding lacks mandatory certification evidence.", "use_case": "procurement", "status": "DRAFT", "assurance_level": "STANDARD", "created_at": "2026-07-28T06:00:00Z", "updated_at": "2026-07-28T06:00:00Z",
  "created_by": {"id": "procurement-agent", "role": "GENERATOR", "kind": "AGENT"}, "requested_by": {"id": "procurement-requester", "role": "OWNER", "kind": "HUMAN"}, "current_owner": {"id": "buyer-1", "role": "OWNER", "kind": "HUMAN"}, "canonical_action": null,
  "claims": [{"id": "CLAIM-1", "statement": "Supplier certification is valid.", "mandatory_evidence": true}], "evidence": [], "assumptions": [], "constraints": [], "policies": [{"id": "SUPPLIER-POLICY", "version": "2.0", "requires_review": false}], "risks": [{"id": "RISK-1", "level": "MEDIUM", "unresolved": false}], "conflicts": [], "validation_results": [], "review_requirements": [{"id": "REVIEW-1", "required_role": "REVIEWER", "mandatory": true, "satisfied": false}], "approvals": [], "decision_outcome": null, "outcome_reasons": [], "audit_events": []
}
